{
  "$schema": "../shared/brand/brand-config.schema.json",
  "brandId": "default",
  "theme": {
    "name": "Shaka with Ease Live",
    "backgroundColor": "#111111",
    "textColor": "#f5f5f5",
    "accentColor": "#ffffff",
    "accentTextColor": "#111111",
    "fontFamily": "sans-serif"
  },
  "easeLive": {
    "accountId": "autotests",
    "projectId": "5b07b1ee-62cb-4c06-9fe5-fc98d4b3a1f0",
    "programId": "ease-live-ui-test-1",
    "env": "prod"
  },
  "streamUrl": "https://stream-akamai.castr.com/5b9352dbda7b8c769937e459/live_2361c920455111ea85db6911fe397b9e/index.fmp4.m3u8"
}
